tweet_id,text,language,type,bookmark_count,favorite_count,retweet_count,reply_count,view_count,created_at,client,hashtags,urls,media_type,media_urls
'1776309821454639106',@javiermacaya Muchas gracias querido @javiermacaya ❤️,es,Reply,0,14,0,0,3036,2024-04-05 15:03:58,"<a href=""http://twitter.com/download/iphone"" rel=""nofollow"">Twitter for iPhone</a>",,,,
'1776233061027348763',"Hoy comenzamos la jornada con más de 200 jóvenes de la Facultad de Gobierno de @GobiernoUDD. Hablamos del panorama político en este año de elecciones municipales y pude compartir mi visión y experiencia. Muchísimas gracias por esta invitación, estuvo muy entretenido. https://t.co/G3HMMmnpKM",es,Tweet,6,452,55,309,73970,2024-04-05 09:58:57,"<a href=""http://twitter.com/download/iphone"" rel=""nofollow"">Twitter for iPhone</a>",,,photo,https://pbs.twimg.com/media/GKZyjLSXkAAK0DV.jpg
'1775984218750832984',"Nuestro equipo de fiscalización, se encuentra realizando un operativo a cuidadores ilegales que están en algunos puntos de la comuna. Les pedimos por favor no aceptar estas malas prácticas y alertar inmediatamente al 1414. https://t.co/Z6zjS8ZZFc",es,Tweet,1,134,17,13,5639,2024-04-04 17:30:08,"<a href=""http://twitter.com/download/iphone"" rel=""nofollow"">Twitter for iPhone</a>",,,photo,"https://pbs.twimg.com/media/GKWQOLkWcAAF1kZ.jpg,https://pbs.twimg.com/media/GKWQOLnW0AAyD44.jpg,https://pbs.twimg.com/media/GKWQOLlWkAA9v1A.jpg,https://pbs.twimg.com/media/GKWQOLkXAAACHgw.jpg"
'1775904924477378899',"CUENTA PÚBLICA DIRECCIÓN DE SALUD🏥🩺
Hoy, conocemos el detalle del trabajo realizado por la Dirección de Salud de @Muni_provi, en cada uno de los CESFAM, durante el 2023. ¡Muchas felicitaciones a cada uno de los profesionales de la salud por su impecable labor!👏🏽 https://t.co/KF2Kccnylf",es,Retweet,0,8,3,4,2970,2024-04-04 12:15:03,"<a href=""http://twitter.com/download/iphone"" rel=""nofollow"">Twitter for iPhone</a>",,,photo,"https://pbs.twimg.com/media/GKVIGVOXkAApzCB.jpg,https://pbs.twimg.com/media/GKVIGVQWUAAUMti.jpg,https://pbs.twimg.com/media/GKVIGVMWcAAZdn5.jpg,https://pbs.twimg.com/media/GKVIGVTXsAAatgZ.jpg"
'1775873240600121559',"El ministerio de Justicia se comprometió a inhibir la señal de celulares en cárceles. Es importante que el ministro confirme públicamente si ya están funcionando o no. Esta medida es crucial para combatir las mafias al interior de los recintos penitenciarios. Yo, sinceramente espero que esta medida esté adoptada y no que estemos actuando con miedo a motines o amenazas.",es,Tweet,0,152,54,46,9891,2024-04-04 10:09:09,"<a href=""http://twitter.com/download/iphone"" rel=""nofollow"">Twitter for iPhone</a>",,,photo,https://pbs.twimg.com/media/GKUrTFJXIAAJZC_.jpg
'1775646831411646642',"Esto, realmente ha sido un sueño y un anhelo por muchos años. Es una tremenda emoción que estemos tan cerca de tener una #ley que será de ayuda a tantas mujeres. Las cifras del mercado laboral femenino y la tranquilidad de las familias de contar con sala cuna universal, será un cambio sustancial para miles de chilenos. Esperamos que pronto pueda ser una realidad 🤞🏼",es,Tweet,2,924,165,164,32328,2024-04-03 19:09:29,"<a href=""http://twitter.com/download/iphone"" rel=""nofollow"">Twitter for iPhone</a>",#ley,,photo,https://pbs.twimg.com/media/GKRdX_BWkAAiKLz.jpg
'1775604560393908397',"Quiero tomarme un minuto para destacar el tremendo logro de la astrónoma chilena @terepaneque. Lograr este tipo de becas, es algo realmente valioso para su carrera, y sin duda que servirá de inspiración para otras jóvenes, para que en un futuro tengamos a muchas mujeres en la ciencia, astronomía, biología, y tantas otras materias en las que podemos ser líderes 💪🏻 Muchas felicitaciones y espero que sea una tremenda y enriquecedora experiencia.",es,Tweet,1,662,68,106,24881,2024-04-03 16:21:30,"<a href=""http://twitter.com/download/iphone"" rel=""nofollow"">Twitter for iPhone</a>",,,photo,https://pbs.twimg.com/media/GKQ27ylXIAAQa7m.jpg
'1775646617921593581',"@varcaya @terepaneque Es que de eso, precisamente de eso se trata Víctor. Un abrazo.",es,Reply,0,9,0,3,800,2024-04-03 19:08:38,"<a href=""http://twitter.com/download/iphone"" rel=""nofollow"">Twitter for iPhone</a>",,,,
'1775557656998019451',"Ya llegaron los días más fríos y les tengo una invitación imperdible para este fin de semana en @Muni_provi. A @Montecarmelo_cc llega 𝐄𝐋 𝐅𝐄𝐒𝐓𝐈𝐕𝐀𝐋 𝐃𝐄 𝐋𝐀 𝐋𝐀𝐍𝐀, una actividad gratuita y abierta al público donde podrán encontrar talleres, artesanía, teatro, música, telar, charlas y más. ¡Están todos invitados! 

Jueves 4, viernes 5 y sábado 6 de abril desde las 12:00 horas en Av Bellavista 0594.",es,Tweet,0,30,10,2,3214,2024-04-03 13:15:08,"<a href=""http://twitter.com/download/iphone"" rel=""nofollow"">Twitter for iPhone</a>",,,photo,"https://pbs.twimg.com/media/GKQMRKWXEAA42cu.jpg,https://pbs.twimg.com/media/GKQMRKXXgAIEnJf.jpg,https://pbs.twimg.com/media/GKQMRKXXUAA2Mzc.jpg,https://pbs.twimg.com/media/GKQMRKXWwAATL35.jpg"
'1775263995748032766',"Una tarde llena de emociones ha sido la de hoy. Recibí con mucho orgullo y también humildad, el premio a la Trayectoria Ingeniería Comercial de la @ucatolica. Jamás pensé recibir este reconocimiento y no saben la alegría y emoción que ha sido. Solo me queda agradecer a cada uno de los presentes, a mi familia, un apoyo fundamental, a mis amigos y equipos de trabajo. ¡Muchas gracias!",es,Tweet,7,1103,97,223,72276,2024-04-02 17:48:14,"<a href=""http://twitter.com/download/iphone"" rel=""nofollow"">Twitter for iPhone</a>",,,video,https://video.twimg.com/amplify_video/1775263610870362113/vid/avc1/720x1280/0XCDOXl3FizcBUmi.mp4?tag=14
'1775537368998478311',@mduranvaldes @ucatolica Gracias Mónica.,es,Reply,0,0,0,1,500,2024-04-03 11:54:31,"<a href=""https://mobile.twitter.com"" rel=""nofollow"">Twitter Web App</a>",,,,
'1775537296353161527',@helguetaa @ucatolica Amorosa Hilda!,es,Reply,0,0,0,0,388,2024-04-03 11:54:13,"<a href=""https://mobile.twitter.com"" rel=""nofollow"">Twitter Web App</a>",,,,
'1775537130569351333',@jlbritonativo @ucatolica Gracias José Luis,es,Reply,0,0,0,0,464,2024-04-03 11:53:34,"<a href=""https://mobile.twitter.com"" rel=""nofollow"">Twitter Web App</a>",,,,
'1775537073044255219',"@raulale16704463 @ucatolica Que amoroso Raúl, muchas gracias",es,Reply,0,1,0,0,387,2024-04-03 11:53:20,"<a href=""https://mobile.twitter.com"" rel=""nofollow"">Twitter Web App</a>",,,,
'1775536964323729829',@mpaz66 @ucatolica Muchisimas gracias,es,Reply,0,1,0,1,513,2024-04-03 11:52:54,"<a href=""https://mobile.twitter.com"" rel=""nofollow"">Twitter Web App</a>",,,,
'1775527417815126506',@ClauditaQueen @ucatolica Gracias Claudita,es,Reply,0,0,0,0,426,2024-04-03 11:14:58,"<a href=""https://mobile.twitter.com"" rel=""nofollow"">Twitter Web App</a>",,,,
'1775527348537810992',@Mgel0Ngel @ucatolica Amoroso!!,pt,Reply,0,0,0,0,440,2024-04-03 11:14:42,"<a href=""https://mobile.twitter.com"" rel=""nofollow"">Twitter Web App</a>",,,,
'1775527286281801849',@PatricioporCHI @ucatolica Muchísimas gracias,es,Reply,0,1,0,0,447,2024-04-03 11:14:27,"<a href=""https://mobile.twitter.com"" rel=""nofollow"">Twitter Web App</a>",,,,
'1775527239456567413',@Carito21Sa @ucatolica Abrazos Caro,es,Reply,0,1,0,2,488,2024-04-03 11:14:16,"<a href=""https://mobile.twitter.com"" rel=""nofollow"">Twitter Web App</a>",,,,
'1775527162235265102',"@gyuseff @ucatolica Es un orgullo gigante, Gonzalo. Gracias por tus palabras.",es,Reply,0,3,1,2,492,2024-04-03 11:13:57,"<a href=""https://mobile.twitter.com"" rel=""nofollow"">Twitter Web App</a>",,,,
'1775527038029357530',@ViviParedesM @ucatolica Muchísimas gracias Vivi,es,Reply,0,2,0,0,581,2024-04-03 11:13:28,"<a href=""https://mobile.twitter.com"" rel=""nofollow"">Twitter Web App</a>",,,,
'1775526930130796696',@raulale16704463 @ucatolica gracias Raúl,es,Reply,0,0,0,0,71,2024-04-03 11:13:02,"<a href=""https://mobile.twitter.com"" rel=""nofollow"">Twitter Web App</a>",,,,
'1775512025805799671',@AnglicaAlmarza @ucatolica Muchísimas gracias Angélica.,es,Reply,0,0,0,0,602,2024-04-03 10:13:49,"<a href=""https://mobile.twitter.com"" rel=""nofollow"">Twitter Web App</a>",,,,
'1775491367117963280',"Quiero destacar a cada una de las personas que salen en esta fotografía. Todos ellos son directores y directoras de @Muni_provi , quienes junto a sus respectivos equipos, son los encargados de cada cosa que sucede en la comuna. Sin ellos, nada, absolutamente nada sería posible. Son un tremendo  equipo y los quiero un montón. ¡Gracias a cada uno por el trabajo!",es,Tweet,1,318,27,114,22208,2024-04-03 08:51:43,"<a href=""http://twitter.com/download/iphone"" rel=""nofollow"">Twitter for iPhone</a>",,,photo,https://pbs.twimg.com/media/GKPP-uCXkAA4hsy.jpg
'1775307032150606333',@DrEnriqueParis @pdazan @ucatolica Muchas gracias por estar ahí ☺️,es,Reply,0,30,0,51,6967,2024-04-02 20:39:14,"<a href=""http://twitter.com/download/iphone"" rel=""nofollow"">Twitter for iPhone</a>",,,,
'1775263995748032766',"Una tarde llena de emociones ha sido la de hoy. Recibí con mucho orgullo y también humildad, el premio a la Trayectoria Ingeniería Comercial de la @ucatolica. Jamás pensé recibir este reconocimiento y no saben la alegría y emoción que ha sido. Solo me queda agradecer a cada uno de los presentes, a mi familia, un apoyo fundamental, a mis amigos y equipos de trabajo. ¡Muchas gracias!",es,Tweet,7,1103,97,223,72276,2024-04-02 17:48:14,"<a href=""http://twitter.com/download/iphone"" rel=""nofollow"">Twitter for iPhone</a>",,,video,https://video.twimg.com/amplify_video/1775263610870362113/vid/avc1/720x1280/0XCDOXl3FizcBUmi.mp4?tag=14
'1775132121364898049',"MES DE LA CONCIENTIZACIÓN DEL CEA💙
En Providencia, trabajamos para promover el respeto y la inclusión, por ello, en el #DíaMundialdelAutismo, junto a Carolina, Alonso y María José, te contamos cuáles serán las actividades que @DiversidadProvi tendrá. ¡Dale play e infórmate! https://t.co/VNWrVmBARC",es,Retweet,0,8,4,4,7007,2024-04-02 09:04:12,"<a href=""http://twitter.com/download/iphone"" rel=""nofollow"">Twitter for iPhone</a>",#DíaMundialdelAutismo,,video,https://video.twimg.com/ext_tw_video/1775131821191127040/pu/vid/avc1/1280x720/OktamEbl1z3yjRks.mp4?tag=12
'1775129853362073602',"Buen martes a todos, por acá ya lista para participar de un interesante conversatorio relacionado con el desarrollo económico, organizado por @Cadem_cl y @ucatolica. Seminario: “Los grandes acuerdos que el país necesita para lograr el desarrollo”.  Ya les estaré contando más detalles. Que tengan buena jornada.",es,Tweet,2,987,66,392,46299,2024-04-02 08:55:12,"<a href=""http://twitter.com/download/iphone"" rel=""nofollow"">Twitter for iPhone</a>",,,photo,https://pbs.twimg.com/media/GKKCSm4X0AAjTbA.jpg
'1774846829957435456',"#Providencia: @Carabdechile de la 19ª Comisaría realizan patrullajes preventivos por puntos de venta de permiso de circulación de la comuna de @Muni_provi , esto con la finalidad de brindar seguridad y evitar hechos de carácter delictivo.
#CarabinerosDeTodos https://t.co/kOFgy7ln8v",es,Retweet,0,14,6,1,3244,2024-04-01 14:10:33,"<a href=""http://twitter.com/download/iphone"" rel=""nofollow"">Twitter for iPhone</a>","#Providencia,#CarabinerosDeTodos",,photo,"https://pbs.twimg.com/media/GKGFxYQWcAE-cm4.jpg,https://pbs.twimg.com/media/GKGFxYQW4AA8NKB.jpg,https://pbs.twimg.com/media/GKGFxYfXIAA0-Th.jpg"
'1774832730095702215',"BOLSA DE RIEGO PARA ÁRBOLES🌱💧
Ayúdanos a cuidar el medio ambiente, postulando para ser el tutor de un nuevo ejemplar, con esta innovadora tecnología de riego. Solo debes ser residente e ingresar, acá👉🏽https://t.co/NHLqoNz7Ub https://t.co/RCbwsMarrk",es,Retweet,0,10,6,3,3129,2024-04-01 13:14:32,"<a href=""https://mobile.twitter.com"" rel=""nofollow"">Twitter Web App</a>",,https://providencia.cl/provi/explora/noticias/medio-ambiente/agua-riego-bolsas,photo,"https://pbs.twimg.com/media/GKF4ycgXsAAVZ2t.jpg,https://pbs.twimg.com/media/GKF4yceXIAEwRRZ.jpg"
'1774776849488298243',"Comenzar la jornada con estas imágenes es totalmente alarmante. Sólo espero que todos los involucrados estén sin lesiones que lamentar. Esta medida de solicitar identificación en #LoValledor, y que evalúan en #LaVega, deja en evidencia el estado de nuestra #seguridad, de la cual como país no nos hemos hecho cargo. 

Las autoridades de Gobierno, en vez de preocuparse si esto es discriminatorio o no, deberían ocuparse en cómo mejorar las condiciones de seguridad. En todo edificio público se solicita una identificación, que privados lo hagan no es el problema, el fondo de esto son los niveles de delincuencia y armas.",es,Tweet,57,1430,382,484,164258,2024-04-01 09:32:29,"<a href=""http://twitter.com/download/iphone"" rel=""nofollow"">Twitter for iPhone</a>","#LoValledor,#LaVega,#seguridad",,video,https://video.twimg.com/amplify_video/1774776792672350208/vid/avc1/1280x720/My9YFmR_6Sk8qOtn.mp4?tag=14
'1774446730093695444',Estamos felices de ver a tantos vecinos disfrutar y compartir en familia. ¡Hasta las 13 hrs los esperamos en Chocolate y Diversión en las plazas Río de Janeiro y Patricio Aylwin! 😉 @Muni_provi https://t.co/uq71LeQ8LF,es,Tweet,0,139,15,29,9754,2024-03-31 11:40:42,"<a href=""http://twitter.com/download/iphone"" rel=""nofollow"">Twitter for iPhone</a>",,,photo,"https://pbs.twimg.com/media/GKAZ4vEWoAAA9HM.jpg,https://pbs.twimg.com/media/GKAZ4vFXYAAvgmD.jpg,https://pbs.twimg.com/media/GKAZ4vFXAAA83I8.jpg"
'1774201975690936608',"🔵#PROVIINFORMA Corte de tránsito en Nueva Providencia esquina Suecia, vehículos están siendo desviados por Suecia al sur. Esto se debe a un procedimiento por emanación de gas en la vía pública. Bomberos, Carabineros y equipos municipales se encuentran trabajando en el lugar. https://t.co/SZgQ6mQeZc",es,Retweet,0,10,6,4,4941,2024-03-30 19:28:08,"<a href=""http://twitter.com/download/iphone"" rel=""nofollow"">Twitter for iPhone</a>",#PROVIINFORMA,,photo,"https://pbs.twimg.com/media/GJ87SYxW8AAosCI.jpg,https://pbs.twimg.com/media/GJ87SYxXoAAgsQ5.jpg,https://pbs.twimg.com/media/GJ87SYwW0AAn48C.jpg"
'1774119280969183403',"CHOCOLATES &amp; DIVERSIÓN PRO🥚🐰🍫

¿A quiénes veremos mañana? 😍 Magia, teatro, baile y mucho chocolate, te esperan mañana domingo 31, en Plaza Patricio Aylwin y Río de Janeiro, en un evento pensado para  l familia.

¡Nos vemos desde las 10:30hrs! 🐰👋 https://t.co/OsLD2dJMKU",es,Retweet,0,8,4,2,3464,2024-03-30 13:59:32,"<a href=""http://twitter.com/download/iphone"" rel=""nofollow"">Twitter for iPhone</a>",,,photo,https://pbs.twimg.com/media/GJ7wE8sWQAAXWIh.jpg
'1774081176275239179',"Hace algunos días, les conté que pasé por fuera de la casa en donde viví cuando era chica, frente a la @FACh_Chile. Por supuesto, aproveché de tomarme una foto 📸 😊 ¡Que tengan un buen #sábado! https://t.co/iKcTCQGXR1",es,Tweet,8,991,40,353,61700,2024-03-30 11:28:07,"<a href=""http://twitter.com/download/iphone"" rel=""nofollow"">Twitter for iPhone</a>",#sábado,,photo,https://pbs.twimg.com/media/GJ7NbHWWwAA2CLv.jpg
'1774058170148671910',"¡PAGA SIN MULTAS! Recuerda que hasta este lunes, podrás pagar tu #PermisoDeCirculación sin multas en nuestros módulos presenciales y online. Desde el martes 2 abril, solo funcionará el módulo presencial ubicado en 📍Av. Pedro de Valdivia 963. 

Más info 👉 https://t.co/4Lu0K98rpW https://t.co/n5EytOzN0g",es,Retweet,0,6,2,3,3112,2024-03-30 09:56:42,"<a href=""http://twitter.com/download/iphone"" rel=""nofollow"">Twitter for iPhone</a>",#PermisoDeCirculación,https://providencia.cl/provi/explora/noticias/municipalidad/permisos-de-circulacion-2024,photo,"https://pbs.twimg.com/media/GJ64f3UW4AAa-T1.jpg,https://pbs.twimg.com/media/GJ64f3VWQAAGrFZ.jpg"
'1773849875890811065',"Este domingo 31, de 10:30 a 13:00 horas, tendremos un evento completamente gratuito en las plazas Patricio Aylwin y Río de Janeiro. No se lo pierdan, los esperamos! 😉 https://t.co/4LoQqgdKyU",es,Tweet,0,70,13,6,9320,2024-03-29 20:09:01,"<a href=""http://twitter.com/download/iphone"" rel=""nofollow"">Twitter for iPhone</a>",,,photo,"https://pbs.twimg.com/media/GJ37Dd2WAAIdmxJ.jpg,https://pbs.twimg.com/media/GJ37Dd4W4AIf8-r.jpg,https://pbs.twimg.com/media/GJ37Dd3WAAAm5QK.jpg"
'1773698912282419516',"🌻🌼 Belleza y utilidad, el proyecto de #JardinesSustentables para la vida silvestre 🐝. Proporcionando elementos esenciales de un hábitat, como alimento, agua, refugio y un lugar para la anidación 💪🏼 https://t.co/cMazxv5p2U",es,Tweet,1,162,10,14,8989,2024-03-29 10:09:09,"<a href=""http://twitter.com/download/iphone"" rel=""nofollow"">Twitter for iPhone</a>",#JardinesSustentables,,video,"https://video.twimg.com/amplify_video/1773698836201971712/vid/avc1/720x878/oT70XRy5hCpyO4Vh.mp4?tag=14,"
'1773339848209821746',Ya estamos pronto a iniciar un fin de semana largo y acá seguimos trabajando en diversas cosas para nuestros vecinos de @Muni_provi 💪 ¡Que tengan una linda jornada! https://t.co/NDDXxvUB4m,es,Tweet,1,377,23,116,12031,2024-03-28 10:22:21,"<a href=""http://twitter.com/download/iphone"" rel=""nofollow"">Twitter for iPhone</a>",,,photo,https://pbs.twimg.com/media/GJwrMKzWoAAyMN_.jpg
'1773386349506150488',"@AnglicaAlmarza @Muni_provi Muchas gracias, Angélica. Un abrazo 🌺",es,Reply,0,0,0,2,202,2024-03-28 13:27:08,"<a href=""http://twitter.com/download/iphone"" rel=""nofollow"">Twitter for iPhone</a>",,,,
'1773369322179645499',"Muchos de ustedes me han preguntado sobre la campaña de vacunación contra la influenza, y les cuento que en @Muni_provi tenemos 3 lugares habilitados: Cesfam Dr. Alessandri, Cesfam El Aguilucho y Cesfam Dr. Alfonso Leng. Si estás dentro de los grupos de riesgo acude a tu cesfam más cercano 💪 Conoce los horarios, aquí 👇",es,Tweet,1,30,16,13,5177,2024-03-28 12:19:28,"<a href=""http://twitter.com/download/iphone"" rel=""nofollow"">Twitter for iPhone</a>",,,photo,https://pbs.twimg.com/media/GJxF_yKWYAANiAB.jpg
'1773133686973587576',"Hoy el alcalde @CristobalLira nos dio a conocer que no irá a la reelección, por una decisión personal y familiar. No puedo más que valorar su profunda nobleza y su gran trabajo al servicio de #LoBarnechea y sus vecinos. Su profesionalismo y entrega deja en lo alto su gestión municipal.",es,Tweet,2,339,47,145,29300,2024-03-27 20:43:08,"<a href=""http://twitter.com/download/iphone"" rel=""nofollow"">Twitter for iPhone</a>",#LoBarnechea,,photo,"https://pbs.twimg.com/media/GJtvsDAW0AAjjKV.jpg,https://pbs.twimg.com/media/GJtvsDAXcAEeEtl.jpg"
'1773100854062530964',"Para este fin de semana, les tenemos un gran panorama preparado junto a @Muni_provi. Como es tradición, tendremos Chocolates y Diversión en las Plazas Río de Janeiro y Patricio Aylwin. Los esperamos este domingo 31 de marzo, desde las 10:30 hrs. ¡Nos vemos! 😉🥚🐰 https://t.co/tQpMykfJr2",es,Tweet,1,18,5,5,3410,2024-03-27 18:32:40,"<a href=""http://twitter.com/download/iphone"" rel=""nofollow"">Twitter for iPhone</a>",,,photo,https://pbs.twimg.com/media/GJtR007XEAAeAAi.jpg
'1773029866243273212',"#cuidatufacultad. El Decano @ruiztaglepablo, junto a la Alcaldesa de @Muni_provi, @evelynmatthei, y la Vicerrectora de @VaecUchile, Josiane Bonnefoy, inauguraron oficialmente el Jardín de la Escuela, un nuevo espacio para nuestra comunidad universitaria 👏 https://t.co/9jtRv1Gobo",es,Retweet,1,85,20,1,10098,2024-03-27 13:50:36,"<a href=""https://metricool.com"" rel=""nofollow"">Metricool</a>",#cuidatufacultad,,photo,https://pbs.twimg.com/media/GJsRQ4aXAAAOAUM.jpg
'1773065222883786777',"Toda acción que contribuya a cuidar el medio ambiente va a tener el apoyo de @Muni_provi. Por eso, estamos muy contentos de haber entregado un permiso a la Facultad de @derechouchile, que les permite utilizar la franja oriente de su histórico edificio con la implementación de jardines sustentables, que no tan solo hermosean el entorno sino que, ayudan en el cuidado de un recurso tan preciado como el agua 💪",es,Tweet,1,78,16,15,5666,2024-03-27 16:11:05,"<a href=""http://twitter.com/download/iphone"" rel=""nofollow"">Twitter for iPhone</a>",,,photo,"https://pbs.twimg.com/media/GJsuPAeXUAEL_tw.jpg,https://pbs.twimg.com/media/GJsuPAjWcAAvwes.jpg,https://pbs.twimg.com/media/GJsuPAhWAAAjw81.jpg,https://pbs.twimg.com/media/GJsuPArXsAAj2kg.jpg"
'1772703606346494394',"CHOCOLATES &amp; DIVERSIÓN PRO🥚🐰🍫
La magia de la pascua te espera, este domingo 31, en Plaza Patricio Aylwin y Río de Janeiro, desde las 10:30hrs, para que disfrutes junto a tu familia, GRATIS. ¡No te lo pierdas! Más info👉🏽https://t.co/CcgH9iXCSs https://t.co/vl05fFFFVC",es,Retweet,1,11,6,1,2453,2024-03-26 16:14:09,"<a href=""https://mobile.twitter.com"" rel=""nofollow"">Twitter Web App</a>",,https://providencia.cl/provi/explora/noticias/municipalidad/no-te-pierdas-chocolates-y-diversion-pro,photo,https://pbs.twimg.com/media/GJnogODXgAAPcrd.jpg
'1772728167398035847',Mucha atención con esta información 👇,es,Tweet,0,20,8,16,8026,2024-03-26 17:51:45,"<a href=""http://twitter.com/download/iphone"" rel=""nofollow"">Twitter for iPhone</a>",,,,
'1772727715436679678',"#PROVIINFORMA🔵: por motivos de fuerza mayor, las dependencias del 3° Juzgado de Policía Local, deberán permanecer cerradas durante toda la semana. Más información, acá👉🏽 https://t.co/m7vMAtmBnz https://t.co/4dc6Z6APyn",es,Retweet,1,6,2,1,11104,2024-03-26 17:49:57,"<a href=""http://twitter.com/download/iphone"" rel=""nofollow"">Twitter for iPhone</a>",#PROVIINFORMA,https://providencia.cl/provi/explora/noticias/municipalidad/cierre-temporal-juzgados-de-policia-local,photo,https://pbs.twimg.com/media/GJn-dNbXsAATDTZ.jpg
'1772689015797321834',"En una emotiva ceremonia, despedimos a los funcionarios que se acogen a la ley de retiro voluntario. En @Muni_provi estamos muy orgullosos de todo el trabajo realizado durante estos años, un verdadero ejemplo de vocación de servicio público. #Providencia es un mejor lugar gracias a ustedes ❤️",es,Tweet,0,147,21,9,7291,2024-03-26 15:16:10,"<a href=""http://twitter.com/download/iphone"" rel=""nofollow"">Twitter for iPhone</a>",#Providencia,,video,https://video.twimg.com/amplify_video/1772688925951225856/vid/avc1/720x1280/k1wiZypUAFMPM9t0.mp4?tag=14
'1772629224840421547',"Cuando uno ve estas declaraciones, realmente afloran las escasas credenciales democráticas que tiene el PC. Me cuesta creer que un partido que es parte del gobierno, esté llamando nuevamente a algo que pueda llevar a un estallido social, después de tanto que ha costado estabilizar Chile. Es inaceptable e irresponsable que existan estas declaraciones.",es,Tweet,20,2152,729,1178,184400,2024-03-26 11:18:35,"<a href=""http://twitter.com/download/iphone"" rel=""nofollow"">Twitter for iPhone</a>",,,photo,https://pbs.twimg.com/media/GJmk4c2XwAA7yLv.jpg
'1772355798405914645',"En @Muni_provi hemos dado a conocer, por más de un año la evolución de los llamados motochorros en las calles de nuestra comuna y es realmente indignante que, a pesar de identificarlos y disponer todos los antecedentes a las instituciones pertinentes, hoy se encuentren libres e incluso delinquiendo en otro país. Urge mayor coordinación para combatir a las organizaciones criminales y lograr desarticularlas.",es,Tweet,2,470,149,96,42181,2024-03-25 17:12:05,"<a href=""http://twitter.com/download/iphone"" rel=""nofollow"">Twitter for iPhone</a>",,,video,https://video.twimg.com/amplify_video/1772353145957388289/vid/avc1/1080x720/LszwZkBlM7BuCvQ8.mp4?tag=14
'1772345935558778996',"PERMISO DE CIRCULACIÓN🚙📍
¡Últimos días! Se nos va Marzo y con él la oportunidad de realizar el trámite de tu automóvil en los módulos de atención. 
Conoce las ubicaciones en https://t.co/ikgdXjlFSB y asiste de 9:00 a 18:00hrs. ¡Evita dejarlo para el final de la semana!🧐 https://t.co/megSDej4DG",es,Retweet,0,6,2,2,2687,2024-03-25 16:32:54,"<a href=""http://twitter.com/download/iphone"" rel=""nofollow"">Twitter for iPhone</a>",,http://Providencia.cl,video,https://video.twimg.com/ext_tw_video/1772345902721581057/pu/vid/avc1/720x1280/GrEaTp6gzh8egJ1I.mp4?tag=12
'1772268145065054602',"Recuerda que si estás en los grupos de riesgo, ya puedes vacunarte contra la influenza en los Cesfam de @Muni_provi 😉",es,Tweet,0,11,2,3,5192,2024-03-25 11:23:47,"<a href=""http://twitter.com/download/iphone"" rel=""nofollow"">Twitter for iPhone</a>",,,,
'1771699224263999620',Felicitaciones al equipo de paisajismo de la @Muni_provi . Mientras uno avanza se ve como las abejas 🐝 andan de flor en flor. 👍🏼 https://t.co/XAvPGw6NO9,es,Retweet,0,52,5,2,3599,2024-03-23 21:43:06,"<a href=""http://twitter.com/download/iphone"" rel=""nofollow"">Twitter for iPhone</a>",,,photo,https://pbs.twimg.com/media/GJZXDRiXQAAlz-J.jpg
'1772029989707264267',"#PROVIINFORMA🔵: Este lunes 25 y martes 26, el 3° Juzgado de Policía Local, por motivos de fuerza mayor, 𝗡𝗢 atenderá publico. ¡Sigue atento a nuestras Redes Sociales y a https://t.co/ikgdXjlFSB! https://t.co/Y7JxZF1RvQ",es,Retweet,0,6,7,2,4430,2024-03-24 19:37:26,"<a href=""http://twitter.com/download/iphone"" rel=""nofollow"">Twitter for iPhone</a>",#PROVIINFORMA,http://Providencia.cl,photo,https://pbs.twimg.com/media/GJeD4RpXoAAnO6D.jpg
